Name,LinkedIn URL,Role,Company,Relevance Score,Personalization Hook,Outreach Message,Status,Skip Reason,Target Persona,Timestamp
Avinash Baghel,https://in.linkedin.com/in/baghelavinash,Lead Data Engineer,PayNearby,10,"He works at PayNearby, a fintech company that enables financial inclusion for millions of Indians, which shows his passion for using technology to drive social impact.","Avinash, your work at PayNearby is making a significant impact in driving financial inclusion for millions of Indians. Given your experience in building technology solutions for social impact, your insights would be valuable in understanding how recruitment processes can be improved. What are your thoughts on using automation in hiring?",pending,,data engineers working at fintech startups in Bangalore,2026-02-27 22:50
Sarvendu Singh,https://in.linkedin.com/in/sarvendusingh,Not found,Stealth Startup,8,"He recently became an AWS Certified Solutions Architect – Associate, showcasing his commitment to continuous learning and skill development in cloud architecture.",Sarvendu Singh recently became an AWS Certified Solutions Architect – Associate. Your expertise in cloud architecture is relevant to the recruitment process I'm working to automate. How do you think AI can aid in finding the right candidates for cloud roles?,pending,,data engineers working at fintech startups in Bangalore,2026-02-27 22:50
Brindan Dsouza,https://in.linkedin.com/in/brindan-dsouza-78268418b,Not found,Validus Fintech Services Pvt Ltd,8,"He liked a post about the challenges of SQL interviews, indicating his interest in data engineering and problem-solving.","SQL interviews can be tough, especially when it comes to optimizing queries. Building an agent to assist in the recruitment process made your interest in data engineering and problem-solving stand out. What are some common SQL challenges you think are often overlooked?",pending,,data engineers working at fintech startups in Bangalore,2026-02-27 22:50
Prashant,https://in.linkedin.com/in/prashant-fintech,Senior Risk Data Engineer,Not found,8,"Bridging the gap between quantitative finance, AI/ML, and distributed systems engineering, a unique combination of skills.","Bridging the gap between quantitative finance, AI/ML, and distributed systems engineering is a unique combination of skills. Your work in risk data engineering aligns with the tech recruitment challenges I'm trying to solve. What are the top skills you look for when hiring engineers in this space?",pending,,data engineers working at fintech startups in Bangalore,2026-02-27 22:50
Sidharth Sankar,https://in.linkedin.com/in/sidharthsankar,Not found,FinTech Startup,8,"He has experience with cloud-native, micro-service architectures with Docker and has shown interest in Kubernetes by liking a post about setting up a homelab running Kubernetes.","Your work with cloud-native and micro-service architectures using Docker is really interesting, especially with the added interest in Kubernetes. Building recruitment tools is my current focus, and your experience with scalable tech seems relevant. What are your thoughts on automating parts of the recruitment process?",pending,,data engineers working at fintech startups in Bangalore,2026-02-27 22:50
